{
  "data_sources": [
    {
      "platform": "meta_marketing_api",
      "api_endpoint": "act_<id>/insights",
      "api_version": "v19.0",
      "auth_method": "oauth2_system_user",
      "required_env_vars": ["META_ACCESS_TOKEN", "META_AD_ACCOUNT_ID", "META_BUSINESS_ID"],
      "account_id_placeholder": "TBD_act_meta",
      "metrics_pulled": ["impressions", "clicks", "spend", "purchase_value", "actions:purchase", "actions:add_to_cart"],
      "dimensions_pulled": ["campaign_id", "adset_id", "ad_id", "date"],
      "pull_frequency": "daily",
      "rate_limit_observed": "Tier-2 system user: ~60k calls/hour, well below cap",
      "last_pulled_at": "2026-04-29T08:00:00Z",
      "status": "ok",
      "rows_fetched": 421
    },
    {
      "platform": "tiktok_marketing_api",
      "api_endpoint": "report/integrated/get/",
      "api_version": "v1.3",
      "auth_method": "oauth2_user",
      "required_env_vars": ["TIKTOK_ACCESS_TOKEN", "TIKTOK_ADVERTISER_ID"],
      "account_id_placeholder": "TBD_advertiser_tiktok",
      "metrics_pulled": ["impressions", "clicks", "spend", "complete_payment", "complete_payment_rate", "video_play_actions"],
      "dimensions_pulled": ["campaign_id", "adgroup_id", "ad_id", "stat_time_day"],
      "pull_frequency": "daily",
      "last_pulled_at": "2026-04-29T08:05:00Z",
      "status": "ok",
      "rows_fetched": 287
    },
    {
      "platform": "google_ads_api",
      "api_endpoint": "customers/<id>/googleAds:searchStream",
      "api_version": "v17",
      "auth_method": "oauth2_user",
      "required_env_vars": ["GOOGLE_ADS_DEVELOPER_TOKEN", "GOOGLE_ADS_CLIENT_ID", "GOOGLE_ADS_CLIENT_SECRET", "GOOGLE_ADS_REFRESH_TOKEN", "GOOGLE_ADS_CUSTOMER_ID"],
      "account_id_placeholder": "TBD_google_ads",
      "metrics_pulled": ["metrics.impressions", "metrics.clicks", "metrics.cost_micros", "metrics.conversions", "metrics.conversions_value"],
      "dimensions_pulled": ["campaign.id", "ad_group.id", "segments.date"],
      "pull_frequency": "daily",
      "last_pulled_at": "2026-04-29T08:10:00Z",
      "status": "ok",
      "rows_fetched": 198
    },
    {
      "platform": "ga4_data_api",
      "api_endpoint": "properties/<id>:runReport",
      "api_version": "v1beta",
      "auth_method": "service_account",
      "required_env_vars": ["GA4_PROPERTY_ID", "GA4_SERVICE_ACCOUNT_JSON_PATH"],
      "account_id_placeholder": "TBD_ga4_property",
      "metrics_pulled": ["sessions", "totalUsers", "engagementRate", "conversions", "purchaseRevenue", "averagePurchaseRevenue"],
      "dimensions_pulled": ["sessionSourceMedium", "landingPage", "deviceCategory", "date"],
      "pull_frequency": "daily",
      "last_pulled_at": "2026-04-29T08:15:00Z",
      "status": "ok",
      "rows_fetched": 612
    },
    {
      "platform": "stripe_api",
      "api_endpoint": "charges.list + customers.list",
      "api_version": "2025-09-15",
      "auth_method": "api_key",
      "required_env_vars": ["STRIPE_SECRET_KEY"],
      "account_id_placeholder": "TBD_stripe_account",
      "metrics_pulled": ["amount_captured", "refunded", "currency", "status"],
      "dimensions_pulled": ["created", "metadata.order_id", "metadata.customer_email_hash"],
      "pull_frequency": "daily",
      "last_pulled_at": "2026-04-29T08:20:00Z",
      "status": "ok",
      "rows_fetched": 89
    },
    {
      "platform": "search_console_api",
      "api_endpoint": "sites/<site>/searchAnalytics/query",
      "api_version": "v1",
      "auth_method": "service_account",
      "required_env_vars": ["GSC_SITE_URL", "GSC_SERVICE_ACCOUNT_JSON_PATH"],
      "account_id_placeholder": "https://roborock-us.example.com/",
      "metrics_pulled": ["clicks", "impressions", "ctr", "position"],
      "dimensions_pulled": ["query", "page", "date"],
      "pull_frequency": "weekly",
      "last_pulled_at": "2026-04-29T08:25:00Z",
      "status": "ok",
      "rows_fetched": 134,
      "error_detail": "Note: GSC has 2-3 day data lag — first usable data expected 2026-05-02"
    }
  ],
  "data_pull": {
    "period_start": "2026-04-22",
    "period_end": "2026-04-28",
    "source_data_source_ids": [0, 1, 2, 3, 4],
    "metrics_by_dim": [
      {
        "dimension": "campaign",
        "rows": [
          { "key": "campaign_001", "impressions": 412330, "clicks": 5621, "spend": { "amount": 1389.5, "currency": "USD" }, "ctr": 0.0136, "cvr": 0.0214, "cpa": { "amount": 11.55, "currency": "USD" }, "roas": 2.81, "purchases": 120, "revenue": { "amount": 3905.85, "currency": "USD" } },
          { "key": "campaign_002", "impressions": 28910, "clicks": 1184, "spend": { "amount": 547.2, "currency": "USD" }, "ctr": 0.0410, "cvr": 0.0735, "cpa": { "amount": 6.29, "currency": "USD" }, "roas": 5.42, "purchases": 87, "revenue": { "amount": 2965.84, "currency": "USD" } },
          { "key": "campaign_003", "impressions": 921400, "clicks": 2102, "spend": { "amount": 348.6, "currency": "USD" }, "ctr": 0.0023, "cvr": 0.0024, "cpa": { "amount": 69.72, "currency": "USD" }, "roas": 0.18, "purchases": 5, "revenue": { "amount": 62.74, "currency": "USD" } },
          { "key": "campaign_004", "impressions": 689210, "clicks": 11487, "spend": { "amount": 1042.8, "currency": "USD" }, "ctr": 0.0167, "cvr": 0.0142, "cpa": { "amount": 6.39, "currency": "USD" }, "roas": 4.03, "purchases": 163, "revenue": { "amount": 4202.49, "currency": "USD" } },
          { "key": "campaign_005", "impressions": 213400, "clicks": 4187, "spend": { "amount": 411.5, "currency": "USD" }, "ctr": 0.0196, "cvr": 0.0084, "cpa": { "amount": 11.69, "currency": "USD" }, "roas": 1.94, "purchases": 35, "revenue": { "amount": 798.31, "currency": "USD" } },
          { "key": "campaign_006", "impressions": 198400, "clicks": 4012, "spend": { "amount": 832.9, "currency": "USD" }, "ctr": 0.0202, "cvr": 0.0356, "cpa": { "amount": 5.83, "currency": "USD" }, "roas": 6.89, "purchases": 143, "revenue": { "amount": 5738.68, "currency": "USD" } },
          { "key": "campaign_007", "impressions": 8420, "clicks": 1841, "spend": { "amount": 245.9, "currency": "USD" }, "ctr": 0.2186, "cvr": 0.1043, "cpa": { "amount": 1.28, "currency": "USD" }, "roas": 14.62, "purchases": 192, "revenue": { "amount": 3595.05, "currency": "USD" } },
          { "key": "campaign_008", "impressions": 142300, "clicks": 2284, "spend": { "amount": 612.4, "currency": "USD" }, "ctr": 0.0161, "cvr": 0.0271, "cpa": { "amount": 9.88, "currency": "USD" }, "roas": 3.31, "purchases": 62, "revenue": { "amount": 2027.04, "currency": "USD" } }
        ]
      },
      {
        "dimension": "creative",
        "rows": [
          { "key": "pairing_001", "impressions": 142800, "clicks": 1623, "spend": { "amount": 421.3, "currency": "USD" }, "ctr": 0.0114, "cvr": 0.0185, "roas": 2.21, "purchases": 30 },
          { "key": "pairing_002", "impressions": 138900, "clicks": 1842, "spend": { "amount": 458.6, "currency": "USD" }, "ctr": 0.0133, "cvr": 0.0212, "roas": 2.74, "purchases": 39 },
          { "key": "pairing_003", "impressions": 130630, "clicks": 2156, "spend": { "amount": 509.6, "currency": "USD" }, "ctr": 0.0165, "cvr": 0.0237, "roas": 3.48, "purchases": 51 },
          { "key": "pairing_005", "impressions": 921400, "clicks": 2102, "spend": { "amount": 348.6, "currency": "USD" }, "ctr": 0.0023, "cvr": 0.0024, "roas": 0.18, "purchases": 5 },
          { "key": "pairing_006", "impressions": 412600, "clicks": 7298, "spend": { "amount": 624.8, "currency": "USD" }, "ctr": 0.0177, "cvr": 0.0148, "roas": 4.31, "purchases": 108 },
          { "key": "pairing_007", "impressions": 276610, "clicks": 4189, "spend": { "amount": 418.0, "currency": "USD" }, "ctr": 0.0151, "cvr": 0.0131, "roas": 3.62, "purchases": 55 },
          { "key": "pairing_009", "impressions": 198400, "clicks": 4012, "spend": { "amount": 832.9, "currency": "USD" }, "ctr": 0.0202, "cvr": 0.0356, "roas": 6.89, "purchases": 143 }
        ]
      },
      {
        "dimension": "landing_route",
        "rows": [
          { "key": "/products/roborock-s-series-pro", "impressions": 0, "clicks": 8945, "purchases": 215, "cvr": 0.0240, "revenue": { "amount": 7244.05, "currency": "USD" } },
          { "key": "/products/roborock-e-series-essential", "impressions": 0, "clicks": 6296, "purchases": 205, "cvr": 0.0326, "revenue": { "amount": 7765.73, "currency": "USD" } },
          { "key": "/collections/pet-households", "impressions": 0, "clicks": 4187, "purchases": 35, "cvr": 0.0084, "revenue": { "amount": 798.31, "currency": "USD" } },
          { "key": "/", "impressions": 0, "clicks": 3943, "purchases": 197, "cvr": 0.0500, "revenue": { "amount": 3657.79, "currency": "USD" } }
        ]
      },
      {
        "dimension": "device",
        "rows": [
          { "key": "mobile", "impressions": 1830200, "clicks": 21156, "spend": { "amount": 3680.4, "currency": "USD" }, "purchases": 543, "cvr": 0.0257, "roas": 3.94 },
          { "key": "desktop", "impressions": 712400, "clicks": 9462, "spend": { "amount": 1456.7, "currency": "USD" }, "purchases": 234, "cvr": 0.0247, "roas": 4.61 },
          { "key": "tablet", "impressions": 174760, "clicks": 2102, "spend": { "amount": 293.8, "currency": "USD" }, "purchases": 30, "cvr": 0.0143, "roas": 2.18 }
        ]
      }
    ]
  },
  "diagnostics": [
    { "id": "diag_001", "observation": "campaign_003 (MET awareness/lifestyle) ROAS 0.18, CTR 0.23% — bottom 5% of all campaigns and creatives.", "hypothesis": "Brand-level lifestyle creative (asset_009) has no product hook; awareness objective is wrong fit for week 1 when Phase 2 retargeting pool is still small. Spend is being burned to fill an audience we can't yet retarget.", "severity": "high", "related_dims": ["campaign:campaign_003", "creative:pairing_005"] },